{
  "$schema": "http://json-schema.org/draft-07/schema#",
  "$id": "https://manim-js.dev/schemas/plugin-manifest.schema.json",
  "title": "Manim Portable Plugin Manifest",
  "description": "A portable, language-neutral description of the shareable subset of a manim plugin: color palettes, rate functions (as expressions), parametric surfaces (as expressions), and SVG shape libraries. Loaded by both manim-js (TypeScript) and Python manim via thin adapters.",
  "type": "object",
  "required": ["name", "version"],
  "additionalProperties": false,
  "properties": {
    "name": {
      "type": "string",
      "description": "Plugin identifier, e.g. \"cyberpunk\".",
      "minLength": 1
    },
    "version": {
      "type": "string",
      "description": "Plugin version (semver recommended).",
      "minLength": 1
    },
    "description": {
      "type": "string",
      "description": "Optional human-readable description."
    },
    "colors": {
      "type": "object",
      "description": "Named colors. Each value is a hex string (#rgb or #rrggbb, optionally #rrggbbaa).",
      "additionalProperties": {
        "type": "string",
        "pattern": "^#([0-9a-fA-F]{3}|[0-9a-fA-F]{4}|[0-9a-fA-F]{6}|[0-9a-fA-F]{8})$"
      }
    },
    "rateFunctions": {
      "type": "object",
      "description": "Named easing/rate functions. Each value is an expression in the single variable `t` (0..1). See README for the expression grammar.",
      "additionalProperties": {
        "type": "string",
        "minLength": 1
      }
    },
    "surfaces": {
      "type": "object",
      "description": "Named parametric surfaces. Each maps parameters (u, v) to a 3D point via three coordinate expressions.",
      "additionalProperties": {
        "type": "object",
        "required": ["x", "y", "z", "uRange", "vRange"],
        "additionalProperties": false,
        "properties": {
          "x": { "type": "string", "description": "Expression in u and v giving the X coordinate." },
          "y": { "type": "string", "description": "Expression in u and v giving the Y coordinate." },
          "z": { "type": "string", "description": "Expression in u and v giving the Z coordinate." },
          "uRange": {
            "type": "array",
            "description": "[uMin, uMax].",
            "items": { "type": "number" },
            "minItems": 2,
            "maxItems": 2
          },
          "vRange": {
            "type": "array",
            "description": "[vMin, vMax].",
            "items": { "type": "number" },
            "minItems": 2,
            "maxItems": 2
          },
          "resolution": {
            "type": "array",
            "description": "Optional [nu, nv] grid resolution.",
            "items": { "type": "integer", "minimum": 1 },
            "minItems": 2,
            "maxItems": 2
          },
          "fillColor": {
            "type": "string",
            "description": "Optional fill color (hex or a name defined in this manifest's `colors`)."
          }
        }
      }
    },
    "shapes": {
      "type": "object",
      "description": "Named SVG shape library. Each value is a complete SVG document string, e.g. \"<svg ...>...</svg>\".",
      "additionalProperties": {
        "type": "string",
        "minLength": 1
      }
    }
  }
}
